Timestamp (UTC),Timestamp (browser time),Connection Name,Message Direction,Message,Comment,Export to CSV
2026-05-29T10:20:40.803Z,05/29/2026 03:20:40.803,EachToSort1-WMSAdapter,WCS => WMS,"18343,r4,csXNU5PQMVd,dz-P-PSOLVE,ES0101,SUCCESS,20260529102040.496",Diverted csXNU5PQMVd to destination ES0101 (requested dest. ES0101) with status SUCCESS
2026-05-29T10:20:34.669Z,05/29/2026 03:20:34.669,EachToSort1-WMSAdapter,WCS => WMS,"18340,r1,csXNU5PQMVd,00000,dz-P-PSOLVE,None,20260529102034.667",Scanned csXNU5PQMVd (request ID 00000)
2026-05-29T10:11:32.637Z,05/29/2026 03:11:32.637,ReceiveSorter1-WMSAdapter,WCS => WMS,"36891,r4,csXNU5PQMVd,dz-P-PSOLVE,RC0104,SUCCESS,20260529101132.361",Diverted csXNU5PQMVd to destination RC0104 (requested dest. RC0104) with status SUCCESS
2026-05-29T10:11:18.455Z,05/29/2026 03:11:18.455,ReceiveSorter1-WMSAdapter,WCS => WMS,"36875,r1,csXNU5PQMVd,00000,dz-P-PSOLVE,None,20260529101118.452",Scanned csXNU5PQMVd (request ID 00000)
2026-05-29T10:10:53.498Z,05/29/2026 03:10:53.498,ReceiveSorter1-WMSAdapter,WMS => WCS,"9999,r2,csXNU5PQMVd,00000,dz-P-PSOLVE,RC0104,2026-05-29T10:10:53.443Z","Routing notification for csXNU5PQMVd (destinations: [RC0104], profile dz-P-PSOLVE). Destination: dz-P-PSOLVE, User: aft-ia, Tool: AFTInboundDirectorService (pre-notification)"
2026-05-29T10:10:53.480Z,05/29/2026 03:10:53.480,EachToSort1-WMSAdapter,WMS => WCS,"9999,r2,csXNU5PQMVd,00000,dz-P-PSOLVE,ES0101,2026-05-29T10:10:53.430Z","Routing notification for csXNU5PQMVd (destinations: [ES0101], profile dz-P-PSOLVE). Destination: dz-P-PSOLVE, User: aft-ia, Tool: AFTInboundDirectorService (pre-notification)"